Input.article_id,Unnamed: 0,Unnamed: 0.1,HITId,HITTypeId,Title,Description,Keywords,Reward,CreationTime,MaxAssignments,RequesterAnnotation,AssignmentDurationInSeconds,AutoApprovalDelayInSeconds,Expiration,NumberOfSimilarHITs,LifetimeInSeconds,AssignmentId,WorkerId,AssignmentStatus,AcceptTime,SubmitTime,AutoApprovalTime,ApprovalTime,RejectionTime,RequesterFeedback,WorkTimeInSeconds,LifetimeApprovalRate,Last30DaysApprovalRate,Last7DaysApprovalRate,Input.p0,Input.p1,Input.p2,Input.p3,Input.p4,Input.p5,Input.year,Answer.article_id,Answer.author,Answer.fiscal_topic_0,Answer.fiscal_topic_0_checkbox.on,Answer.fiscal_topic_1,Answer.fiscal_topic_1_checkbox.on,Answer.fiscal_topic_2,Answer.fiscal_topic_2_checkbox.on,Answer.fiscal_topic_3,Answer.fiscal_topic_3_checkbox.on,Answer.fiscal_topic_4,Answer.fiscal_topic_4_checkbox.on,Answer.fiscal_topic_5,Answer.fiscal_topic_5_checkbox.on,Answer.foreign_topic_0,Answer.foreign_topic_0_checkbox.on,Answer.foreign_topic_1,Answer.foreign_topic_1_checkbox.on,Answer.foreign_topic_2,Answer.foreign_topic_2_checkbox.on,Answer.foreign_topic_3,Answer.foreign_topic_3_checkbox.on,Answer.foreign_topic_4,Answer.foreign_topic_4_checkbox.on,Answer.foreign_topic_5,Answer.foreign_topic_5_checkbox.on,Answer.line_num_fiscal_topic_0,Answer.line_num_fiscal_topic_1,Answer.line_num_fiscal_topic_2,Answer.line_num_fiscal_topic_3,Answer.line_num_fiscal_topic_4,Answer.line_num_fiscal_topic_5,Answer.line_num_foreign_topic_0,Answer.line_num_foreign_topic_1,Answer.line_num_foreign_topic_2,Answer.line_num_foreign_topic_3,Answer.line_num_foreign_topic_4,Answer.line_num_foreign_topic_5,Answer.line_num_social_topic_0,Answer.line_num_social_topic_1,Answer.line_num_social_topic_2,Answer.line_num_social_topic_3,Answer.line_num_social_topic_4,Answer.line_num_social_topic_5,Answer.social_topic_0,Answer.social_topic_0_checkbox.on,Answer.social_topic_1,Answer.social_topic_1_checkbox.on,Answer.social_topic_2,Answer.social_topic_2_checkbox.on,Answer.social_topic_3,Answer.social_topic_3_checkbox.on,Answer.social_topic_4,Answer.social_topic_4_checkbox.on,Answer.social_topic_5,Answer.social_topic_5_checkbox.on,Approve,Reject,Original.p0,Original.p1,Original.p2,Original.p3,Original.p4,Original.p5
195368,64,64,341H3G5YF00VQP7YMHVNP3RWTLT0ZD,3NB4XF0P1WV1612RGVD9LS24VXNL2G,Annotators-Barea 33 Overlap,Annotators Barea 33 Overlap,"polarization, text, classification",$0.00,Mon Oct 12 21:16:03 PDT 2020,4,BatchId:296708;OriginalHitTemplateId:921587277;,31536000,604800,Tue Oct 12 21:16:03 PDT 2021,,,3DUZQ9U6SNAG4YKUKOU63NF012RSVH,A25FEPZ4EXZD68,Approved,Wed Oct 21 14:17:13 PDT 2020,Wed Oct 21 14:22:48 PDT 2020,Wed Oct 28 14:22:48 PDT 2020,Wed Oct 28 14:22:50 PDT 2020,,,335,100% (36/36),100% (36/36),0% (0/0),"1.- At his sixth press <span class='both' style='color: green'>conference</span> , the <span class='both' style='color: green'>President</span> again made a lot of news-enough to give the New York Times nine major stories from the <span class='both' style='color: green'>conference</span> .<br>2.- Samples : <P> A reporter 's request for an analysis of the <span class='dim_s' style='color: red'>Communist</span> <span class='dim_s' style='color: red'>peace</span> offensive got a reply that disclosed the <span class='both' style='color: green'>Administration</span> 's attitude toward the new <span class='dim_s' style='color: red'>Communist</span> <span class='dim_s' style='color: red'>peace</span> offensive .<br>3.- Without forgetting past <span class='both' style='color: green'>history</span> , the <span class='both' style='color: green'>President</span> said , the U.S. <span class='both' style='color: green'>Government</span> should take at face value every offer , until it is proved unworthy ( see above ) .<br>4.- <P> The <span class='both' style='color: green'>President</span> answered mildly and clearly a storm of provocative questions about the McCarthy affair ( see below ) .<br>5.- <P> Ike quickly scotched a report that he would leave the <span class='dim_f' style='color: blue'>cutting</span> of U.S. combat strength to <span class='both' style='color: green'>Secretary</span> Wilson .<br>6.- The size of our <span class='both' style='color: green'>armed</span> forces , he said , would conform with what he always goes back to-George Washington 's old precept of a reasonable posture of <span class='both' style='color: green'>military</span> <span class='both' style='color: green'>defense</span> .<br>","1.- The responsibility for <span class='dim_f' style='color: blue'>cutting</span> would not be one that he would delegate .<br>2.- <P> Reciprocal <span class='dim_f' style='color: blue'>trade</span> agreements are being re-examined carefully , the <span class='both' style='color: green'>President</span> said , and it  favored extension of the agreements for one year .<br>3.- <P> Newshen May Craig was worried about the <span class='both' style='color: green'>Government</span> 's huge <span class='dim_f' style='color: blue'>surplus</span> butter stores ( TIME , April 6 ) , and Ike indicated that he was worried too .<br>4.- He hoped that <span class='both' style='color: green'>Congress</span> would give him the responsibility for finding outlets for the butter before it spoils .<br>5.- It would be a crime to civilization and to ourselves , he added , to allow it to spoil .<br>","1.- He could n't imagine anything worse when people are hungry .<br>2.- <P> A query about <span class='both' style='color: green'>Republican</span> prospects in 1954 drew a smile and a quick reply from the <span class='both' style='color: green'>President</span> .<br>3.- It is just as simple as looking at the palm of your hand , he said .<br>4.- If the <span class='both' style='color: green'>Republican</span> Party can show as its record over the next two years a progressive , sane <span class='both' style='color: green'>program</span> of accomplishment , which takes care of the <span class='both' style='color: green'>welfare</span> and <span class='dim_f' style='color: blue'>interest</span> of all our people and does n't give itself away to any group or class , and if that <span class='both' style='color: green'>program</span> is properly advertised , the G.O.P.<br>5.- will be back with a very greatly enhanced majority .<br>",empty,empty,empty,1953,195368,default,mixed_val,False,mixed_val,False,moderate_val_left,False,default,False,default,False,default,False,moderate_val_left,False,moderate_val_left,False,default,False,default,False,default,False,default,False,5,1-3,,,,,"2, 3",2,,,,,1-6,1-4,2-4,,,,default,False,moderate_val_left,False,moderate_val_left,False,default,False,default,False,default,False,,,"At his sixth press conference , the President again made a lot of news-enough to give the New York Times nine major stories from the conference . Samples : <P> A reporter 's request for an analysis of the Communist peace offensive got a reply that disclosed the Administration 's attitude toward the new Communist peace offensive . Without forgetting past history , the President said , the U.S. Government should take at face value every offer , until it is proved unworthy ( see above ) . <P> The President answered mildly and clearly a storm of provocative questions about the McCarthy affair ( see below ) . <P> Ike quickly scotched a report that he would leave the cutting of U.S. combat strength to Secretary Wilson . The size of our armed forces , he said , would conform with what he always goes back to-George Washington 's old precept of a reasonable posture of military defense .","The responsibility for cutting would not be one that he would delegate . <P> Reciprocal trade agreements are being re-examined carefully , the President said , and it  favored extension of the agreements for one year . <P> Newshen May Craig was worried about the Government 's huge surplus butter stores ( TIME , April 6 ) , and Ike indicated that he was worried too . He hoped that Congress would give him the responsibility for finding outlets for the butter before it spoils . It would be a crime to civilization and to ourselves , he added , to allow it to spoil .","He could n't imagine anything worse when people are hungry . <P> A query about Republican prospects in 1954 drew a smile and a quick reply from the President . It is just as simple as looking at the palm of your hand , he said . If the Republican Party can show as its record over the next two years a progressive , sane program of accomplishment , which takes care of the welfare and interest of all our people and does n't give itself away to any group or class , and if that program is properly advertised , the G.O.P. will be back with a very greatly enhanced majority .",empty,empty,empty
204956,104,104,3D17ECOUOEHUCLLNXT4EZ75RJI031M,3NB4XF0P1WV1612RGVD9LS24VXNL2G,Annotators-Barea 33 Overlap,Annotators Barea 33 Overlap,"polarization, text, classification",$0.00,Mon Oct 12 21:15:56 PDT 2020,4,BatchId:296708;OriginalHitTemplateId:921587277;,31536000,604800,Tue Oct 12 21:15:56 PDT 2021,,,39PAAFCODNMHJYX99OZWDSBM3LRTVT,A25FEPZ4EXZD68,Approved,Thu Oct 15 12:45:25 PDT 2020,Thu Oct 15 12:53:32 PDT 2020,Thu Oct 22 12:53:32 PDT 2020,Thu Oct 22 12:53:44 PDT 2020,,,487,100% (36/36),100% (36/36),0% (0/0),"1.- The U.S.<br>2.- Tries Again <P> Ever since the atom became a <span class='dim_s' style='color: red'>weapon</span> , the U.S. has been creating new <span class='both' style='color: green'>programs</span> for <span class='both' style='color: green'>arms</span> control and <span class='dim_s' style='color: red'>disarmament</span> as fast as the <span class='dim_s' style='color: red'>Russians</span> can reject them .<br>3.- Last week , in his address to the U.N .<br>4.- General Assembly .<br>5.- <span class='both' style='color: green'>President</span> Kennedy put forth still another U.S. offer to get started on planning for <span class='dim_s' style='color: red'>peace</span> .<br>6.- This time the <span class='both' style='color: green'>President</span> picked up and took as his own the <span class='dim_s' style='color: red'>Soviet</span> <span class='dim_s' style='color: red'>Union</span> 's perennial demand for "" general and complete <span class='dim_s' style='color: red'>disarmament</span> "" - but backed up that sweeping plea with some specific proposals .<br>7.- Kennedy 's steps toward <span class='dim_s' style='color: red'>disarmament</span> included : <P> <P> Signing a <span class='dim_s' style='color: red'>nuclear</span> test ban treaty .<br>","1.- "" This can be done now , "" he challenged . ""<br>2.- Test ban <span class='both' style='color: green'>negotiations</span> need not and should not of such materials to nonnuclear powers .<br>3.- <P> Prohibiting the transfer of <span class='dim_s' style='color: red'>nuclear</span> <span class='dim_s' style='color: red'>weapons</span> to nations that do not have them .<br>4.- <P> <P> Keeping <span class='dim_s' style='color: red'>nuclear</span> <span class='dim_s' style='color: red'>weapons</span> from outer space .<br>5.- <P> Destroying strategic <span class='dim_s' style='color: red'>missiles</span> and aircraft that could deliver <span class='dim_s' style='color: red'>nuclear</span> <span class='dim_s' style='color: red'>bombs</span> .<br>","1.- <P> <P> <span class='both' style='color: green'>Actually</span> , the <span class='both' style='color: green'>President</span> 's <span class='both' style='color: green'>program</span> contained little that  Eisenhower-and it offered nothing that seemed likely to lure the <span class='dim_s' style='color: red'>Russians</span> from previous stands against <span class='dim_s' style='color: red'>disarmament</span> inspections .<br>2.- Despite Kennedy 's promise to resume discussions of any one step toward <span class='dim_s' style='color: red'>disarmament</span> whenever agreement seemed in sight , the U.S. plan is basically a step-by-step approach requiring international inspection to ensure that each stage has been carried out .<br>3.- <P> A Start .<br>4.- Until the possibility of eventual <span class='dim_s' style='color: red'>disarmament</span> is destroyed by <span class='dim_s' style='color: red'>Soviet</span> intransigence , Kennedy is willing to keep working for some form of agreement .<br>","1.- Last week that work got a start when the <span class='both' style='color: green'>President</span> signed into <span class='both' style='color: green'>law</span> the brand-new U.S. <span class='both' style='color: green'>Arms</span> Control and <span class='dim_s' style='color: red'>Disarmament</span> <span class='both' style='color: green'>Agency</span> and named William Chapman Foster , 64 , as its director .<br>2.- Set up as a semi-autonomous <span class='both' style='color: green'>agency</span> , operating out of the State Department building , ACADA has long been a pet Kennedy project .<br>3.- Appalled that only about 75 people in the U.S. <span class='both' style='color: green'>Government</span> were at work on <span class='dim_s' style='color: red'>disarmament</span> planning under Eisenhower , Kennedy set out to create a specific <span class='both' style='color: green'>agency</span> for the work , got <span class='both' style='color: green'>congressional</span> approval a fortnight ago .<br>4.- <P> <span class='both' style='color: green'>Bill</span> Foster was a logical choice to head the  , Foster was long ago appraised by the New Frontier 's talent scouts as an able , experienced administrator who might some day fill a job for <span class='both' style='color: green'>President</span> Kennedy .<br>5.- Also like McCone , he is a <span class='both' style='color: green'>Republican</span> , which may help fend off partisan objections to <span class='both' style='color: green'>actions</span> taken by an <span class='both' style='color: green'>agency</span> new to the ways of Washington .<br>6.- Born in New Jersey , courteous , methodical <span class='both' style='color: green'>Bill</span> Foster studied at Massachusetts Institute of Technology , piloted "" Flying Jennies "" as a combat instructor during World <span class='dim_s' style='color: red'>War</span> I , then spent 24 years with Long Island 's Pressed &; Welded <span class='dim_f' style='color: blue'>Steel</span> Products Co.<br>",empty,empty,1961,204956,default,mixed_val,False,mixed_val,False,mixed_val,False,mixed_val,False,default,False,default,False,moderate_val_left,False,moderate_val_left,False,moderate_val_left,False,moderate_val_left,False,default,False,default,False,"2, 6, 7",2-5,"1, 2, 4","1, 3",,,"2, 5-7",2-5,"1, 4",1-3,,,2,2,"1, 2, 4",1-5,,,moderate_val_left,False,moderate_val_left,False,moderate_val_left,False,moderate_val_left,False,default,False,default,False,,,"The U.S. Tries Again <P> Ever since the atom became a weapon , the U.S. has been creating new programs for arms control and disarmament as fast as the Russians can reject them . Last week , in his address to the U.N . General Assembly . President Kennedy put forth still another U.S. offer to get started on planning for peace . This time the President picked up and took as his own the Soviet Union 's perennial demand for "" general and complete disarmament "" - but backed up that sweeping plea with some specific proposals . Kennedy 's steps toward disarmament included : <P> <P> Signing a nuclear test ban treaty .",""" This can be done now , "" he challenged . "" Test ban negotiations need not and should not of such materials to nonnuclear powers . <P> Prohibiting the transfer of nuclear weapons to nations that do not have them . <P> <P> Keeping nuclear weapons from outer space . <P> Destroying strategic missiles and aircraft that could deliver nuclear bombs .","<P> <P> Actually , the President 's program contained little that  Eisenhower-and it offered nothing that seemed likely to lure the Russians from previous stands against disarmament inspections . Despite Kennedy 's promise to resume discussions of any one step toward disarmament whenever agreement seemed in sight , the U.S. plan is basically a step-by-step approach requiring international inspection to ensure that each stage has been carried out . <P> A Start . Until the possibility of eventual disarmament is destroyed by Soviet intransigence , Kennedy is willing to keep working for some form of agreement .","Last week that work got a start when the President signed into law the brand-new U.S. Arms Control and Disarmament Agency and named William Chapman Foster , 64 , as its director . Set up as a semi-autonomous agency , operating out of the State Department building , ACADA has long been a pet Kennedy project . Appalled that only about 75 people in the U.S. Government were at work on disarmament planning under Eisenhower , Kennedy set out to create a specific agency for the work , got congressional approval a fortnight ago . <P> Bill Foster was a logical choice to head the  , Foster was long ago appraised by the New Frontier 's talent scouts as an able , experienced administrator who might some day fill a job for President Kennedy . Also like McCone , he is a Republican , which may help fend off partisan objections to actions taken by an agency new to the ways of Washington . Born in New Jersey , courteous , methodical Bill Foster studied at Massachusetts Institute of Technology , piloted "" Flying Jennies "" as a combat instructor during World War I , then spent 24 years with Long Island 's Pressed &; Welded Steel Products Co.",empty,empty
